{"schema_version":"1.0","scenario":"greeting","subject":"candidate","provenance":"examples/recorded/candidate.rs","environment":"fixture-v1","checkpoints":["done"],"observations":[{"checkpoint":"done","channel":"stdout","occurrence":0,"completeness":"complete","payload":{"kind":"text","value":"Hello\n"}}]}
